{
  "$schema": "https://json-schema.org/draft/2020-12/schema",
  "$id": "https://koine.ecosystem/schemas/finetune-job.schema.json",
  "title": "FinetuneJob",
  "description": "The invoke payload for the KFT `finetune` capability (specs/fine-tuning.md §3, KFT 0.6.0). The machine-readable twin of the job manifest. Two intakes — a base model and a dataset — each a reference plus, optionally, the document that describes it in its own standard's terms, plus the optional `resume` ref that names an interrupted leg of this same training (§3.4) rather than a third intake; the shape follows Kubeflow TrainJob's initializer.{model,dataset}.storageUri precedent (§3.2). Data is referenced by KINP/KGP/KMI id, never inlined, and no descriptor is ever an admission input. The cross-schema $refs below resolve against schemas/provenance.schema.json (shared $defs) and schemas/dataset-jsonl-header.schema.json (the training-record header) in this directory. A golden positive example lives at schemas/fixtures/finetune-job.json; the validators + conformance suite that exercise this schema live downstream in a runtime commons per ADR-0001 (koine = contracts), NOT in koine.",
  "type": "object",
  "$defs": {
    "kinpId": {
      "type": "string",
      "pattern": "^[a-z0-9-]+:[a-z0-9-]+:[^\\s]+$",
      "description": "A KINP CURIE — namespace:kind:local (e.g. orchestrator:activity:ft-run.9f2a, refkb:model:qwen2.5-3b-instruct, kgp:pack:sha256-7b1e…, analyzer:asset:blake3-a1b2…)."
    }
  },
  "properties": {
    "kft_version": {
      "$ref": "provenance.schema.json#/$defs/contractVersion",
      "description": "The KFT spec version this job was authored against (semver). A finetuned model pins the kft_version it was trained under (KFT §11)."
    },
    "job": {
      "$ref": "#/$defs/kinpId",
      "description": "The KINP PROV activity id for this run — the reproducibility anchor (KFT §5.2, FT-C)."
    },
    "base_model": {
      "$ref": "#/$defs/kinpId",
      "description": "Intake 1 — the base-model KINP `model` entity, the counterpart of Kubeflow TrainJob's initializer.model.storageUri (KFT §3.2). External (Hub) bases are minted entities carrying an external anchor to their Hub coordinate — never a raw hf:… string (KFT §5.1, FT-G)."
    },
    "base_model_descriptor": {
      "type": "array",
      "items": { "$ref": "#/$defs/kinpId" },
      "description": "KMI asset ids of the base model's published description — its Hugging Face model card (carrying base_model / base_model_relation, KFT §5.1.1) and/or its KitOps/ModelPack Kitfile (KFT §5.3.1), adopted by reference; KFT restates neither. The model-side twin of dataset.descriptor. Optional and descriptive: the §4.2 egress gate, §4.3 license/trust lineage, and §7 estimate MUST NOT read it, and a base-model coordinate, license, or egress class MUST NOT be derived from it — on disagreement the KINP entity wins (KFT §3.2)."
    },
    "modality": {
      "type": "string",
      "enum": ["text-generation", "image-text-to-text", "video-text-to-text", "text-to-image", "text-to-video", "text-to-audio", "audio-to-audio"],
      "description": "KFT §3.1 modality vocabulary. Registered in koine registry/. modality × method compatibility is validated at admission (FT-F)."
    },
    "method": {
      "type": "string",
      "enum": ["sft", "lora", "qlora", "full", "dpo"],
      "description": "Training method. Not independent of modality — an incompatible combo (e.g. dpo × text-to-image) is rejected at admission (KFT §3.1, FT-F)."
    },
    "dataset": {
      "type": "object",
      "description": "Intake 2 — training data by reference only (KFT §4.1), the counterpart of Kubeflow TrainJob's initializer.dataset.storageUri, split three ways because a koine corpus is knowledge, media, or training records (KFT §3.2). At least one of knowledge/media/records MUST be non-empty.",
      "properties": {
        "knowledge": {
          "type": "array",
          "items": { "$ref": "#/$defs/kinpId" },
          "description": "KGP GroundingPack ids (text/knowledge data)."
        },
        "media": {
          "type": "array",
          "items": { "$ref": "#/$defs/kinpId" },
          "description": "KMI asset ids (multimodal image/video/audio data), fetched lazily via KCB fetch:asset."
        },
        "records": {
          "type": "array",
          "items": { "$ref": "#/$defs/kinpId" },
          "description": "KMI asset ids of the training-record JSONL file(s) — a producing application's training exhaust, and the FT-I per-sample join surface. Each carries media type application/vnd.koine.dataset+jsonl (registry/media-types.tsv) and opens with a dataset-jsonl-header (KFT §4.1, FT-M)."
        },
        "descriptor": {
          "type": "array",
          "items": { "$ref": "#/$defs/kinpId" },
          "description": "KMI asset ids of MLCommons Croissant v1.1 dataset descriptions (application/ld+json), adopted by reference — KFT describes no dataset itself (KFT §4.1.1). Not positional: one descriptor may cover any subset of knowledge/media/records. Optional and descriptive: the §4.2 egress gate, §4.3 license/trust lineage, and §7 estimate MUST NOT read it; on disagreement the dataset-jsonl-header wins."
        },
        "header": {
          "description": "The dataset-jsonl-header(s) copied inline — carries tier + license + egress + recordCount + provenance so the §4.2 gate and §7 estimate run before any fetch. An array, positionally one per records[] entry (FT-O); a bare object is the degenerate one-file form. Verified against the file's actual first record on fetch; a disagreement rejects the job (KFT §4.1).",
          "oneOf": [
            { "$ref": "dataset-jsonl-header.schema.json" },
            { "type": "array", "items": { "$ref": "dataset-jsonl-header.schema.json" } }
          ]
        }
      },
      "anyOf": [
        { "required": ["knowledge"] },
        { "required": ["media"] },
        { "required": ["records"] }
      ],
      "additionalProperties": false
    },
    "resume": {
      "type": "object",
      "description": "OPTIONAL. Present = this job is a continuation leg of a training that was interrupted; absent = a cold run, and every resume clause is inert (KFT §3.4). NOT a third intake and NOT warm start: a prior *released* finetuned model is named by base_model (it is a KINP `model` entity like any other), while this names a *mid-run* checkpoint of the same training. A gating input — the checkpoint's inherited egress class joins the §4.2 aggregate and its license joins the §4.3 union — but never corpus: it MUST NOT also appear in dataset.{knowledge,media,records}[]. A resume ref carried anywhere else in the manifest (notably in the permissive hyperparams, which no normative clause reads) is not a resume ref and the job MUST be refused `invalid` (KFT §3.4, §8.1).",
      "properties": {
        "checkpoint": {
          "$ref": "#/$defs/kinpId",
          "description": "KMI asset id of the checkpoint to resume from — the id KFT §6's telemetry event published. Typed by §5.3 (application/vnd.koine.model+… bytes, byte-hash id, fetched via KCB fetch:asset); no new artifact kind is introduced. MUST appear in the run activity's used[] (KFT §5.2), so it is part of the reproducibility anchor (FT-C)."
        },
        "of_job": {
          "$ref": "#/$defs/kinpId",
          "description": "KINP activity id of the leg that published the checkpoint. The target of this leg's `continues` edge (KFT §5.2, registry/relations.tsv) — distinct from `retrains` (a re-train from scratch) and `supersedes` (a replacement). A continuation leg MUST mint its own `job` activity and MUST NOT reuse this one."
        },
        "at_step": {
          "type": "integer",
          "minimum": 0,
          "description": "The KFT §6 `step` the checkpoint was published at. `step` counts from the start of the training (the root leg), so this is both the operand §7 nets the remainder estimate from and the boundary §6's curve-join rule turns on. The provider MUST verify it against the prior leg's provenance/telemetry rather than trusting the manifest (KFT §7)."
        }
      },
      "required": ["checkpoint", "of_job", "at_step"],
      "additionalProperties": false
    },
    "hyperparams": {
      "type": "object",
      "description": "Method-specific hyperparameters (epochs, lr, max_seq_len, lora{r,alpha,dropout,target_modules}, …). Permissive — engine adapters own the detail (KFT §9) — and read by NO normative clause, which is why a resume checkpoint ref carried here is refused rather than executed (KFT §3.4). With `method`, this is KFT's deliberate divergence from TrainJob, which passes adaptation through spec.trainer.args (KFT §3.2).",
      "additionalProperties": true
    },
    "export": {
      "type": "array",
      "items": { "type": "string" },
      "description": "Requested output variants, e.g. gguf:Q4_K_M, safetensors-adapter, onnx. Each becomes a KMI variant_of/derived_from asset (KFT §5.3)."
    },
    "compute": {
      "type": "object",
      "description": "Placement request. The effective egress is verified against {data ∪ base} at admission and a local-only run is pinned to local compute (KFT §4.2, FT-B).",
      "properties": {
        "class": {
          "type": "string",
          "minLength": 1,
          "description": "Requested compute class (e.g. local-mps, single-gpu-a100-80gb) — a class, not a pod resource shape (contrast TrainJob's spec.trainer.resourcesPerNode; KFT §3.2). A cross-boundary class is rejected for a local-only-effective run (KFT §4.2)."
        },
        "egress": {
          "type": "string",
          "enum": ["derived", "exportable", "local-only"],
          "default": "derived",
          "description": "derived = compute from data ∪ base (recommended); explicit values are still verified and rejected on violation (KFT §4.2, KGP §7.2)."
        }
      },
      "required": ["class"],
      "additionalProperties": false
    },
    "eval": {
      "type": "array",
      "items": { "$ref": "#/$defs/kinpId" },
      "description": "KCS conformance-scenario ids used as eval/reward (KFT §6.1). A local-only model is evaluated in-tier (FT-D)."
    },
    "seed": {
      "type": "integer",
      "description": "Training seed — part of the run's reproducibility anchor (KFT §5.2, FT-C)."
    },
    "config_hash": {
      "type": "string",
      "description": "sha256- of the fully-resolved engine config — the other half of the run reproducibility anchor (KFT §5.2, FT-C)."
    },
    "signing": {
      "type": "object",
      "description": "Shared signing shape (KCB §5 / KGP §9.3) so the run is cryptographically attributable (KFT §7).",
      "properties": {
        "key_id": { "type": "string", "minLength": 1 },
        "alg": { "type": "string", "minLength": 1 }
      },
      "required": ["key_id", "alg"],
      "additionalProperties": false
    }
  },
  "required": ["kft_version", "job", "base_model", "modality", "method", "dataset", "compute"],
  "additionalProperties": false
}
