{
  "kft_version": "0.7.0",
  "job": "orchestrator:activity:ft-run/9f2a-r1",
  "base_model": "refkb:model:qwen2.5-vl-3b-instruct",
  "base_model_descriptor": ["refkb:asset:blake3-mk1f2e3d4c5b"],
  "modality": "image-text-to-text",
  "method": "qlora",
  "dataset": {
    "knowledge": ["kgp:pack:sha256-7b1e0f3c9a2d"],
    "media": ["analyzer:asset:blake3-a1b2c3d4e5f6"],
    "records": ["analyzer:asset:blake3-e9d7c5b3a1f0"],
    "descriptor": ["refkb:asset:blake3-cr0a1b2c3d4e"],
    "header": [
      {
        "record": "header",
        "contractVersion": "0.4.0",
        "datasetKind": "vl-caption-sft",
        "source": "analyzer",
        "tier": "synthetic",
        "license": "CC-BY-4.0",
        "egress": "exportable",
        "recordCount": 4820,
        "generatedAt": "2026-07-23T00:00:00Z",
        "provenance": { "world": "worldsim:world:alderforest", "run": "analyzer:activity:gen-run/7c1a" }
      }
    ]
  },
  "resume": {
    "checkpoint": "orchestrator:asset:blake3-ck40a1b2c3d4",
    "of_job": "orchestrator:activity:ft-run/9f2a",
    "at_step": 4000
  },
  "hyperparams": {
    "epochs": 3,
    "lr": 0.0002,
    "max_seq_len": 2048,
    "lora": { "r": 16, "alpha": 32, "dropout": 0.05, "target_modules": ["q_proj", "k_proj", "v_proj", "o_proj"] }
  },
  "export": ["gguf:Q4_K_M", "safetensors-adapter"],
  "compute": { "class": "single-gpu-a100-80gb", "egress": "derived" },
  "eval": ["kcs:scenario:vespace-rule-gen", "kcs:scenario:cefr-grade"],
  "seed": 42,
  "config_hash": "sha256-3f7a9c1e2b4d6f8a0c2e4b6d8f0a2c4e6b8d0f2a4c6e8b0d2f4a6c8e0b2d4f6a",
  "signing": { "key_id": "orchestrator:key:ed25519-01", "alg": "ed25519" }
}
